asin,Title,Rating,NumberOfReviews,Price
B009UQXD90,"Twinings Earl Grey Black Tea Bags, 100 Count (Pack of 1)",4.8,"71,859 ratings",
B00478FECA,"The Republic of Tea - Hot Apple Cider Tea, 36 Tea Bags, Tin | Harvest Herbal Blend | Caffeine-free",4.5,"2,334 ratings",
B09HW99JD5,"Stash Tea Bags Sampler Assortment Variety Pack Gift, 52 Count",4.7,404 ratings,
B001EQ5JLE,"PG Tips Black Tea, Pyramid Tea Bags, 240-Count Box (Pack of 2)",4.8,"4,361 ratings",
B075F9Y19M,"BLUE RIBBON Twinings Tea Bags Sampler Assortment Variety Pack Gift Box - 48 Count - Perfect Variety - English Breakfast, Green, Black, Herbal, Chai Tea and more",4.7,"13,078 ratings",
B07QL2XZY3,"Lipton Iced Tea K-Cup Pods, Southern Sweet Black Tea, 24 Pods",4.7,"10,465 ratings",
B00GEG40LY,"Bigelow Black Tea 6 Flavor Variety Pack, Caffeinated 20 Count (Pack of 6), 120 Total Tea Bags",4.8,"34,413 ratings",
B00286KM2A,"Lipton Gallon-Sized Iced Tea Bags Picked At The Peak of Freshness Unsweetened Can Help Support a Healthy Heart 48 Oz 48 Count, Standart",4.8,"11,428 ratings",
B0186S3EU0,"Tea Forte English Breakfast Loose Bulk Tea, 1 Pound Pouch, Organic Black Tea Makes 160-170 Cups",4.7,196 ratings,
B08WWHSS4H,"Gold Peak Sweet Tea, Real Brewed Tea, 59 Fl Oz",4.8,472 ratings,
B005Q8BIK2,"Stash Tea Fruity Herbal Tea 6 Flavor Tea Sampler, 6 boxes With 18-20 Tea Bags Each",4.6,"11,769 ratings",
B007M8FRTW,"Yogi Sweet Tangerine Positive Energy, 16 Tea Bags, Packaging May Vary (Pack of 1)",4.7,"2,986 ratings",
B000GBXG2C,"Bewley's Dublin Morning Tea, 80-Count",4.8,675 ratings, 10.06 
B008YA0Z8K,"Bigelow K-Cup for Keurig Brewers, English Breakfast Tea , 24 count (Pack of 4)",4.8,230 ratings,
B079MF5GM2,"Yogi Tea, Honey Chai Turmeric Vitality, 16 ct",4.7,"1,053 ratings",
B01FLNPYHY,"Bigelow English Breakfast Tea K-cup for Keurig Brewers, 24 Count (Pack of 1)",4.7,717 ratings,
B006N3HX6C,"Bigelow Earl Grey Tea, 24-Count K-Cup Portion Pack for Keurig Brewers",4.7,"1,923 ratings",
B0017T2MWW,"Ito En Tea Oi Ocha Green Tea, Unsweetened, 16.9 Ounce (Pack of 12)",4.7,"12,669 ratings",
B00136MKEO,"Ahmad Tea Earl Grey Aromatic Loose Tea, Ceylon Caddy, 17.6 Oz",4.7,"6,263 ratings",
B07M7F6QXJ,"Tazo Tea Bags Sampler 20 Count Variety Gift Box, 10 Different Flavors with By The Cup Honey Sticks",4.6,"1,566 ratings",
B00TJ2BFF4,Greenfield Spring Melody Herbal Tea Collection Finely Selected Speciality Tea 100 Double Chamber Teabags With Tags in Foil Sachets,4.8,213 ratings,
B00FFZQ1RG,Barry's Tea Gold Blend 80 Count (Pack of 2),4.9,"4,051 ratings",
B00IJHU45M,"Honest Tea Organic Fair Trade Half Tea & Half Lemonade Gluten Free, 16.9 Fl. Oz, 12 Pack",4.6,"4,508 ratings",
B07BRBSVK4,"Taylors of Harrogate Organic Peppermint Herbal Tea, 50 Count",4.5,"3,353 ratings",
B0062JSYEW,"Taylors of Harrogate Assorted Specialty Teas Box , 48 count (Pack of 1)",4.7,"23,842 ratings",
B000GFYRKI,"Bigelow Mint Medley Herbal Tea, Caffeine Free, 20 Count (Pack of 6)",4.7,"35,199 ratings",
B07GFPMRWP,"Teavana Jade Citrus Mint, Green Tea With Spearmint and Lemongrass, 15 Count 15 Sachets (Pack of 4)",4.7,"15,640 ratings",
B07HBMZXL4,"Tejava Unsweetened Peach Iced Tea, 16.9 Ounce PET Bottles, Natural, Non-GMO-Verified, Rainforest Alliance-Certified (12 Pack)",4.4,"1,986 ratings",
B01G3JBGHM,"Pure Leaf Iced Tea, Sweetened Variety Pack, 18.5 fl oz. bottles (12 Pack)",4.6,"7,873 ratings",
B07QDPWHRL,"Harney & Sons Victorian London Fog Tea | 30 Sachets, Historic Royal Palaces Collection",4.8,"3,909 ratings",
B07875HFC6,"Ocha & Co. Organic Gyokuro Green Tea – Shade Grown Japanese Loose Leaf Green Tea – Smooth Umami-Rich Aromatic Organic Green Tea from Japan, 100g/3.5oz.",4.5,242 ratings,
B07288BJXV,"Celestial Seasonings Wellness Tea, Sleepytime Extra, Caffeine Free Sleep Tea, 40 Tea Bags (Pack of 6)",4.8,"7,857 ratings",
B0B6DBNH6S,Yogi Tea - Pumpkin Spice Tea (4 Pack) - Eases Tension and Supports Relaxation - Limited Holiday Release - Caffeine Free - 64 Organic Herbal Tea Bags,4.5,35 ratings,
B08B9H8MH7,"Amazon Basics Stainless Steel Tea Kettle, 2.0-Quart, Silver",4.5,563 ratings,
B000GG1O80,"Bigelow Green Tea with Peach, Caffeinated, 20 Count (Pack of 6), 120 Total Tea Bags",4.8,"18,851 ratings",
B076ZWKYL1,"Brooke Bond, Red Label Loose Leaf Black Tea, 450g(gm)",4.5,"1,186 ratings",
B07MLJSPXF,"Amazon Basic Care Severe Cold & Flu Relief, Green Tea & Honey Lemon Flavors; Relieves Cough, Sore Throat Pain, Body Ache, Headache and Fever, 6 Count",4.7,"1,304 ratings",
B000MNRC1K,"Taylors of Harrogate Pure Assam, 50 Teabags",4.5,"20,367 ratings",
B07X4N934R,"Amazon Brand - Happy Belly Green Tea Bags, Citrus, 20 Count (Pack of 6)",4.1,103 ratings,
B07W14VGVR,"Ahmad Tea - Favorite Tea Bags Sampler Assortment Box - 60 Count - Variety Tea Bags in Gift Box - Gift for Family, Friends, Coworkers - English Breakfast, English Afternoon, Green",4.6,"1,967 ratings",
B07D44YMWH,"Twinings Herbal Tea Bags - 40 Individually Wrapped Tea Bags, Pure Peppermint, Camomile, Rooibos Red, Honeybush Mandarin Orange, Plus 9 More Flavors - with BYTC Honey Sticks",4.7,"4,126 ratings",
B07WQFWGHV,Yogi Tea - Get Well Variety Pack Sampler (6 Pack) - Herbal Teas for Cold and Flu Symptom Support - Caffeine Free - 96 Organic Herbal Tea Bags,4.8,"3,923 ratings",
B00GKL51PW,"Pg Tips Tea Bags, 240 Count, Pack of 2",4.8,"5,388 ratings",
B006N3I8PC,"Twinings Earl Grey K-Cup Pods for Keurig, Caffeinated Black Tea Flavoured with Citrus and Bergamot, 24 Count (Pack of 1)",4.8,"5,997 ratings",
B015Z6WJDY,"Pure Leaf Iced Tea, Unsweetened Black Tea, 18.5 Oz Bottles (12 Pack)",4.7,"28,184 ratings",
B07Z8FDK8H,"Tazo Tea Bags Sampler Assortment Variety Pack Gift Box - 42 Count - 14 Different Flavors Perfect Variety – Passion Fruit, Awake English Breakfast, Early Grey, Green, Herbal, Chai Tea and more …",4.6,"2,502 ratings",
B07B3WC49R,Tea Bags Sampler Assortment Box (Blue Ribbon Box - 52 Count),4.7,"7,725 ratings",
B0017T6S0Y,"Teas' Tea Unsweetened Pure Green Tea, Organic, Sugar Free, 0 Calories, 16.9 Ounce (Pack of 12)",4.5,"4,239 ratings",
B00PO9NHES,"Harney and Sons Hot Cinnamon Spice, Bag of 50 Sachets, Black Tea w/ Orange Pieces and Cloves",4.9,"5,948 ratings",
